{
  "kind": "chapter",
  "generated_at": "2026-07-06T00:00:00Z",
  "schema_version": "2.0",
  "chapter": 1,
  "title": "玄天剑醒来",
  "chapter_goal": "让林小雨发现玄天剑拥有意识，并启动灵根复测压力",
  "reader_promise": "交付金手指觉醒和身份谜团",
  "conflict_axis": "林小雨想隐藏玄天剑异动，但宗门复测马上到来",
  "turning_point": "玄天剑叫出林小雨从未告诉他人的乳名",
  "summary": "林小雨在外门祠堂听见玄天剑残念传声，得知废剑并非凡物；执事长老随后宣布灵根复测，迫使她立刻面对暴露风险。",
  "scene_beats": [
    "林小雨在祠堂听见玄天剑传声。",
    "玄天剑叫出她的乳名。",
    "执事长老宣布灵根复测。"
  ],
  "state_delta_plan": {
    "characters": [
      "char_001"
    ],
    "items": [
      "item_001"
    ],
    "scenes": [
      "scene_001"
    ],
    "organizations": [
      "org_001"
    ],
    "concepts": [
      "concept_001"
    ],
    "timeline_events": [
      "event_001"
    ],
    "plot_threads": [
      "plot_001"
    ],
    "relationships": [
      "rel_001"
    ]
  }
}
